{
  "ledger_id": "logos-clearance-ledger-fixture-v1",
  "version": "1.0.0",
  "classification": "INTERNAL \u2014 CONSTITUTIONAL",
  "authority": {
    "human_principal_id": "DWS-001",
    "display_name": "David Warren Smith Jr.",
    "short_code": "DJ",
    "signature_mark": "/D.W.Smith/"
  },
  "created_at": "2026-06-26T09:00:00Z",
  "hash_algorithm": "sha256",
  "signature_algorithm": "ed25519_placeholder",
  "entries": [
    {
      "ledger_entry_id": "LE-e61bf2e9638393e0",
      "timestamp": "2026-06-26T09:00:01Z",
      "source_id": "L1-001",
      "decision_type": "hp_approve",
      "from_status": "hp_pending",
      "to_status": "approved",
      "requested_use": null,
      "actor_id": "DWS-001",
      "actor_role": "human_principal",
      "decision_status": "recorded",
      "decision_reason": "HP approved L1-001 (Buildspec Volumes) for all approved uses.",
      "reg01_status": "not_required",
      "lgl01_status": "not_required",
      "hp_decision_status": "approved",
      "source_registry_version": "1.0.0",
      "source_registry_entry_hash": "",
      "previous_entry_hash": "0000000000000000000000000000000000000000000000000000000000000000",
      "entry_hash": "5ab778b0cf0ab94b56dac4e79fba2a559df4813ae9d396592e00ce5bdc736d91",
      "signature_status": "unsigned_local",
      "signature_algorithm": "ed25519_placeholder",
      "signature_public_key_id": null,
      "signature_value": null,
      "notes": ""
    },
    {
      "ledger_entry_id": "LE-8ddf3f97ae2311a9",
      "timestamp": "2026-06-26T09:00:02Z",
      "source_id": "L1-007",
      "decision_type": "hp_approve",
      "from_status": "hp_pending",
      "to_status": "approved",
      "requested_use": null,
      "actor_id": "DWS-001",
      "actor_role": "human_principal",
      "decision_status": "recorded",
      "decision_reason": "HP approved L1-007 (Synthetic Instruction Data) for sft_candidate and evaluation_reference.",
      "reg01_status": "not_required",
      "lgl01_status": "not_required",
      "hp_decision_status": "approved",
      "source_registry_version": "1.0.0",
      "source_registry_entry_hash": "",
      "previous_entry_hash": "5ab778b0cf0ab94b56dac4e79fba2a559df4813ae9d396592e00ce5bdc736d91",
      "entry_hash": "f60a943c2097f61236913cc0cd499502d844d6e6224d337caa52b68a7a719af9",
      "signature_status": "unsigned_local",
      "signature_algorithm": "ed25519_placeholder",
      "signature_public_key_id": null,
      "signature_value": null,
      "notes": ""
    },
    {
      "ledger_entry_id": "LE-26077805716344f3",
      "timestamp": "2026-06-26T09:00:03Z",
      "source_id": "L6-001",
      "decision_type": "block",
      "from_status": "blocked",
      "to_status": "blocked",
      "requested_use": null,
      "actor_id": "DWS-001",
      "actor_role": "human_principal",
      "decision_status": "blocked",
      "decision_reason": "Common Crawl permanently blocked. Uncertain third-party rights, PII risk.",
      "reg01_status": "not_required",
      "lgl01_status": "not_required",
      "hp_decision_status": "blocked",
      "source_registry_version": "1.0.0",
      "source_registry_entry_hash": "",
      "previous_entry_hash": "f60a943c2097f61236913cc0cd499502d844d6e6224d337caa52b68a7a719af9",
      "entry_hash": "f9791f33d7e1d4cf5623b316913903e4c1eafdc701f101cffa1c3de721f3f5a5",
      "signature_status": "unsigned_local",
      "signature_algorithm": "ed25519_placeholder",
      "signature_public_key_id": null,
      "signature_value": null,
      "notes": ""
    }
  ]
}